"Red Social"|"Publicacion"|"Comentario"|"Sentimiento"|"Explicacion"|"Terminos"
"instagram"|"https://mock.url/p/1"|"Me encanta este proyecto, es excelente!"|"Positivo"|"El comentario contiene palabras que expresan agrado, apoyo o sentimientos favorables."|"Test 2026"
"instagram"|"https://mock.url/p/1"|"Un completo fiasco, no sirve para nada"|"Negativo"|"El comentario contiene palabras asociadas con descontento, críticas o sentimientos desfavorables."|"Test 2026"
"instagram"|"https://mock.url/p/1"|"Es interesante de revisar"|"Neutro"|"El comentario es de carácter informativo u objetivo, sin una carga emocional predominante."|"Test 2026"
"instagram"|"https://mock.url/p/2"|"Excelente herramienta para base de datos"|"Positivo"|"El comentario contiene palabras que expresan agrado, apoyo o sentimientos favorables."|"Test 2026"
"instagram"|"https://mock.url/p/2"|"No me gusta el color del dashboard"|"Positivo"|"El comentario contiene palabras que expresan agrado, apoyo o sentimientos favorables."|"Test 2026"
"instagram"|"https://mock.url/p/2"|"Un comentario de prueba neutral"|"Neutro"|"El comentario es de carácter informativo u objetivo, sin una carga emocional predominante."|"Test 2026"
